{"build":{"artifact_digest":null,"ccache_key":null,"flags":[],"gpu_arches":[],"toolchain":[]},"checks":[{"command_digest":"sha256:d0ae0207302fd4aa08b23da4404bbca8a7ebc556157e67f5c27902754aac0859","exit_code":0,"name":"source_identity","status":"passed","summary":"source identity passed"},{"command_digest":"sha256:8948b31e0e5e88544ca6a179c873260cebf2fb20e421e524eca3c60f0411bb16","exit_code":0,"name":"runtime_identity","status":"passed","summary":"runtime_identity passed"},{"command_digest":"sha256:5f52319a5a65c9638e48400d9b79b42b64e8634386dc5e67d2026a42d971a16a","exit_code":0,"name":"target_module_provenance","status":"passed","summary":"target_module_provenance passed"},{"command_digest":"sha256:e1b15c4cd0b9547f5a4c00b359a58ed7d6fe015e3cef1cdefc6e34874cf287d8","exit_code":0,"name":"target_import","status":"passed","summary":"target_import passed"},{"command_digest":"sha256:fcc4ceea4bdb32c1f6004663957199197a0c4dd09fab788287f5a5fc8b369792","exit_code":0,"name":"selector_collection","status":"passed","summary":"selector_collection passed"},{"command_digest":"sha256:cade73b39d9efa850e2359889b161ebf5d679d92e5c100ba105ab30ac78dddf3","exit_code":0,"name":"minimal_operation","status":"passed","summary":"minimal_operation passed"}],"content_hash":"sha256:ac9b42e88b1fc72a1e51a81b24fd1ba07b30b498c1101fe4d1399f673a3bf150","contract_type":"matched_runtime_compatibility","created_at":"2026-07-26T22:05:15Z","evidence_id":"compatibility:v1:020796f93d98a8837cf8065b76b6ba87292886d150580a30a1075873fa448310","failure":null,"runtime":{"artifact_digest":"sha256:14a7a8b595347dddca594f9e448b93ce68ce4f871acbd32cf04bda7c03664c0c","artifact_digest_kind":"wheel_sha256","artifact_id":"torch-2.4.0+cpu-cp311-cp311-linux_x86_64.whl","artifact_kind":"official_wheel","compute_capability":null,"cuda_build":null,"cuda_runtime":null,"device_name":null,"environment_id":"pytorch-matched-boundary-torch2.4.0-cpu","platform":"linux/x86_64","python_abi":"cpython-311-x86_64-linux-gnu","python_implementation":"CPython","source_loading_mode":"python_overlay","target_module_path_suffix":"torch/_inductor/lowering.py","target_module_sha256":"sha256:3a969abd6475314d701a9fd107f4bbc4ac5011f971222ec640ef798791950ca2","torch_version":"2.4.0+cpu"},"schema_version":"v1","source":{"commit":"15ca562f863ffe69d76c0ccaf448b27d18ceb2e8","runtime_path_suffix":"torch/_inductor/lowering.py","snapshot_digest":"sha256:3acabd5f692c8558338a2e4e698df0f541bff306f3b60cb81c422efeb863fa57","snapshot_digest_kind":"git_archive_sha256","source_id":"pytorch-15ca562-boundary-overlay","target_module_path":"torch/_inductor/lowering.py","target_module_sha256":"sha256:3a969abd6475314d701a9fd107f4bbc4ac5011f971222ec640ef798791950ca2"},"status":"compatible","strategy":"matched_wheel","task_id":"pytorch__126461__cummin_rank_zero"}